{
 "schema": "praxis.labels/1",
 "clip_id": "cup3d_05",
 "exercise": "cup",
 "labeller": "render",
 "labelled_at": "generated",
 "fps": 12.0,
 "complete": true,
 "notes": "Synthetic 3-D render (evaluation/blender); times from the script, not a human labeller.",
 "reps": [
  {
   "rep": 1,
   "t_start": 1.5608,
   "t_end": 2.6017,
   "expected": "verified",
   "reason": null,
   "deliberate_error": null,
   "to_dot": 1
  },
  {
   "rep": 2,
   "t_start": 4.1548,
   "t_end": 5.1286,
   "expected": "verified",
   "reason": null,
   "deliberate_error": null,
   "to_dot": 2
  },
  {
   "rep": 3,
   "t_start": 6.742,
   "t_end": 7.6602,
   "expected": "verified",
   "reason": null,
   "deliberate_error": null,
   "to_dot": 3
  },
  {
   "rep": 4,
   "t_start": 9.1406,
   "t_end": 10.269,
   "expected": "verified",
   "reason": null,
   "deliberate_error": null,
   "to_dot": 4
  },
  {
   "rep": 5,
   "t_start": 11.8819,
   "t_end": 12.8897,
   "expected": "verified",
   "reason": null,
   "deliberate_error": null,
   "to_dot": 3
  },
  {
   "rep": 6,
   "t_start": 14.5196,
   "t_end": 15.6732,
   "expected": "verified",
   "reason": null,
   "deliberate_error": null,
   "to_dot": 2
  },
  {
   "rep": 7,
   "t_start": 17.2213,
   "t_end": 18.2278,
   "expected": "verified",
   "reason": null,
   "deliberate_error": null,
   "to_dot": 1
  },
  {
   "rep": 8,
   "t_start": 19.732,
   "t_end": 20.8381,
   "expected": "verified",
   "reason": null,
   "deliberate_error": null,
   "to_dot": 0
  },
  {
   "rep": 9,
   "t_start": 22.4103,
   "t_end": 23.4727,
   "expected": "verified",
   "reason": null,
   "deliberate_error": null,
   "to_dot": 1
  },
  {
   "rep": 10,
   "t_start": 25.0087,
   "t_end": 26.0271,
   "expected": "verified",
   "reason": null,
   "deliberate_error": null,
   "to_dot": 2
  },
  {
   "rep": 11,
   "t_start": 27.4995,
   "t_end": 28.4589,
   "expected": "verified",
   "reason": null,
   "deliberate_error": null,
   "to_dot": 3
  },
  {
   "rep": 12,
   "t_start": 30.052,
   "t_end": 31.0182,
   "expected": "verified",
   "reason": null,
   "deliberate_error": null,
   "to_dot": 4
  },
  {
   "rep": 13,
   "t_start": 32.5425,
   "t_end": 33.6515,
   "expected": "verified",
   "reason": null,
   "deliberate_error": null,
   "to_dot": 3
  },
  {
   "rep": 14,
   "t_start": 35.2122,
   "t_end": 36.2212,
   "expected": "verified",
   "reason": null,
   "deliberate_error": null,
   "to_dot": 2
  },
  {
   "rep": 15,
   "t_start": 37.7596,
   "t_end": 38.7055,
   "expected": "verified",
   "reason": null,
   "deliberate_error": null,
   "to_dot": 1
  },
  {
   "rep": 16,
   "t_start": 40.2593,
   "t_end": 41.2704,
   "expected": "verified",
   "reason": null,
   "deliberate_error": null,
   "to_dot": 0
  },
  {
   "rep": 17,
   "t_start": 42.6295,
   "t_end": 43.1488,
   "expected": "verified",
   "reason": null,
   "deliberate_error": null,
   "to_dot": 1
  },
  {
   "rep": 18,
   "t_start": 44.2752,
   "t_end": 44.7788,
   "expected": "verified",
   "reason": null,
   "deliberate_error": null,
   "to_dot": 2
  },
  {
   "rep": 19,
   "t_start": 45.8044,
   "t_end": 46.332,
   "expected": "verified",
   "reason": null,
   "deliberate_error": null,
   "to_dot": 3
  },
  {
   "rep": 20,
   "t_start": 47.3257,
   "t_end": 47.8333,
   "expected": "verified",
   "reason": null,
   "deliberate_error": null,
   "to_dot": 4
  },
  {
   "rep": 21,
   "t_start": 48.9594,
   "t_end": 49.5084,
   "expected": "verified",
   "reason": null,
   "deliberate_error": null,
   "to_dot": 3
  },
  {
   "rep": 22,
   "t_start": 50.6043,
   "t_end": 51.1266,
   "expected": "verified",
   "reason": null,
   "deliberate_error": null,
   "to_dot": 2
  },
  {
   "rep": 23,
   "t_start": 52.2276,
   "t_end": 52.736,
   "expected": "verified",
   "reason": null,
   "deliberate_error": null,
   "to_dot": 1
  },
  {
   "rep": 24,
   "t_start": 53.7977,
   "t_end": 54.3355,
   "expected": "verified",
   "reason": null,
   "deliberate_error": null,
   "to_dot": 0
  },
  {
   "rep": 25,
   "t_start": 55.4345,
   "t_end": 55.9725,
   "expected": "verified",
   "reason": null,
   "deliberate_error": null,
   "to_dot": 1
  },
  {
   "rep": 26,
   "t_start": 57.0622,
   "t_end": 57.664,
   "expected": "verified",
   "reason": null,
   "deliberate_error": null,
   "to_dot": 2
  },
  {
   "rep": 27,
   "t_start": 58.6873,
   "t_end": 59.1834,
   "expected": "verified",
   "reason": null,
   "deliberate_error": null,
   "to_dot": 3
  },
  {
   "rep": 28,
   "t_start": 60.3174,
   "t_end": 60.9017,
   "expected": "verified",
   "reason": null,
   "deliberate_error": null,
   "to_dot": 4
  },
  {
   "rep": 29,
   "t_start": 61.9153,
   "t_end": 62.4825,
   "expected": "verified",
   "reason": null,
   "deliberate_error": null,
   "to_dot": 3
  },
  {
   "rep": 30,
   "t_start": 63.6319,
   "t_end": 64.2247,
   "expected": "verified",
   "reason": null,
   "deliberate_error": null,
   "to_dot": 2
  },
  {
   "rep": 31,
   "t_start": 65.3277,
   "t_end": 65.8207,
   "expected": "verified",
   "reason": null,
   "deliberate_error": null,
   "to_dot": 1
  },
  {
   "rep": 32,
   "t_start": 66.9022,
   "t_end": 67.4381,
   "expected": "verified",
   "reason": null,
   "deliberate_error": null,
   "to_dot": 0
  }
 ]
}
